title,author,subreddit,score,num_comments
Trump Fires Hundreds of Staff Overseeing Nuclear Weapons: Report,ClydeFrog1313,politics,49905,4147
Trump to Fire Hundreds From FAA Despite Four Deadly Crashes on His Watch,Quirkie,politics,44467,2276
‘We’ve been betrayed:’ Local veterans angry after being laid off by Trump administration,Rock-n-roll-Kevin,politics,41400,2804
This is the correct response to Trump’s reaction to recent tragedy,HazyDavey68,democrats,40990,1276
"Trump officials fired nuclear staff not realizing they oversee the country’s weapons stockpile, sources say",Optimal-Kitchen6308,politics,38220,2119
"Nazi flags can fly in Utah schools, but not pride flags, GOP lawmaker says",PrithvinathReddy,politics,35861,1573
Elon Musk Says Team Behind CBS's '60 Minutes' Deserves 'A Long Prison Sentence',ObjectiveAd6551,politics,33932,2657
RFK Jr. is already taking aim at anti-depressants,ReaderBeeRottweiler,politics,33656,5692
Elon Musk is doing everything conspiracy theorists accuse George Soros of,z8675309z,politics,33286,918
Conservatives want a Reddit safe space,PM-ME-SMILES-PLZ,democrats,32693,2233
